{
  "schema_version": "fatigue-rule-result.v0.1",
  "session_id": "SYNTH_D4_WARN_POWERLINE",
  "status": "completed",
  "downstream_allowed": true,
  "abstention": false,
  "config": {
    "config_id": "fatigue_rule_v0.1",
    "engine_type": "explainable_rule_engine",
    "threshold_status": "provisional_engineering_defaults",
    "outputs_probability": false,
    "outputs_frs": false,
    "outputs_diagnosis": false,
    "clinical_validation_status": "not_validated"
  },
  "upstream_evidence": {
    "config_id": "fatigue_evidence_v0.1",
    "result_hash_sha256": "bc9cce3e175627d27192a7f24ffc9b436978ebd59c1312404f98fbd9668adce1"
  },
  "overall": {
    "technical_conclusion": "supported_pattern",
    "rule_strength": "moderate"
  },
  "reason_codes": [
    "RULE_ALL_CHANNELS_SUPPORT_PATTERN"
  ],
  "result_hash_sha256": "102dddd7ee0270814cf2f2ec43ef9fbe54a57e706fdb58e015092642377e40ef",
  "channels": [
    {
      "channel": {
        "channel_id": "VL_R_01",
        "muscle": "vastus_lateralis",
        "side": "right",
        "role": "bipolar_semg"
      },
      "phase_id": "active_contraction",
      "source_pattern_category": "multi_domain_change_pattern_observed",
      "technical_conclusion": "supported_pattern",
      "rule_strength": "strong",
      "reason_codes": [
        "RULE_MULTI_DOMAIN_PATTERN_SUPPORTED"
      ],
      "decision_basis": [
        {
          "code": "BASIS_FREQUENCY_DOMAIN_SUPPORT",
          "text_vi": "Miền tần số có xu hướng hỗ trợ mẫu biến đổi được định nghĩa trước.",
          "source_domains": [
            "frequency"
          ],
          "source_features": [
            "mdf",
            "mnf"
          ]
        },
        {
          "code": "BASIS_AMPLITUDE_DOMAIN_SUPPORT",
          "text_vi": "Miền biên độ có xu hướng hỗ trợ mẫu biến đổi được định nghĩa trước.",
          "source_domains": [
            "amplitude"
          ],
          "source_features": [
            "rms",
            "mav"
          ]
        }
      ],
      "counterevidence": [],
      "interpretation_guard": "Đây là kết luận kỹ thuật theo rule v0.1, không phải chẩn đoán, xác suất bệnh hoặc khuyến nghị điều trị."
    }
  ],
  "limitations": [
    "Rule v0.1 chỉ ánh xạ structured evidence theo logic kỹ thuật tạm thời; chưa được local hoặc clinical validation.",
    "supported_pattern không đồng nghĩa chẩn đoán mỏi cơ và không cho phép tự động điều chỉnh điều trị.",
    "no_supported_pattern chỉ có nghĩa chưa đáp ứng rule v0.1, không có nghĩa cơ không mỏi.",
    "Amplitude-only pattern được giữ ở trạng thái inconclusive vì RMS/MAV phụ thuộc lực, recruitment và setup điện cực."
  ],
  "required_review": "human_review_required_before_any_future_clinical_use"
}
